{
  "schema_version": "1.4",
  "brief_id": "KCC-202610-01",
  "client_code": "KCC",
  "vertical": "food-beverage",
  "business_type": "cafe",
  "location_area": "Badung, Bali",
  "objective": {
    "type": "walk-in",
    "key_message": "Sarapan pagi sebelum surf: dibuka 06.30, kopi Kintamani, menu tanpa daging tersedia",
    "success_metric": "Jumlah pelanggan yang menyebut kode PAGI di kasir",
    "metric_source": "Catatan kasir client (fiktif)"
  },
  "audience": {
    "segments": ["surfer pagi", "pekerja remote", "wisatawan"],
    "origin": ["Jakarta", "Australia"],
    "language": "bilingual-id-en",
    "english_variant": "en-GB"
  },
  "voice": {
    "evidence_label": "CLIENT CONFIRMATION",
    "archetype": "santai-playful",
    "address": "kamu",
    "emoji_rule": "Maks 2 per caption, relevan (kopi/ombak)"
  },
  "channels": [
    { "channel": "instagram", "format": "single image", "quantity": 1, "paid": false, "cta": { "type": "save" } },
    { "channel": "google-business-profile", "format": "update post", "quantity": 1, "paid": false }
  ],
  "offer": {
    "name": "Paket Pagi",
    "price": 65000,
    "currency": "IDR",
    "unit": "per-person",
    "tax_service": "plus-plus",
    "valid_from": "2026-11-01",
    "valid_to": "2026-11-30",
    "terms": "Kopi + pilihan sarapan dari menu Paket Pagi; berlaku 06.30–09.00 setiap hari; dine-in",
    "evidence_label": "DATA FINAL"
  },
  "claims": [
    { "claim": "Buka setiap hari 06.30–22.00", "category": "facility", "evidence_label": "DATA FINAL", "source": "Fact sheet fiktif KCC v1 (sama dengan GBP)", "source_date": "2026-10-09" },
    { "claim": "Kopi arabika Kintamani dari roaster lokal", "category": "food-beverage", "evidence_label": "DATA FINAL", "source": "Invoice roaster fiktif KCC-INV-07", "source_date": "2026-10-09" },
    { "claim": "Menu sarapan tanpa daging tersedia (2 pilihan)", "category": "halal-dietary", "evidence_label": "DATA FINAL", "source": "Menu fiktif KCC v3", "source_date": "2026-10-09" },
    { "claim": "Parkir motor di depan, mobil di lahan sebelah (berbayar)", "category": "location", "evidence_label": "DATA FINAL", "source": "Fact sheet fiktif KCC v1", "source_date": "2026-10-09" },
    { "claim": "5 menit jalan kaki ke pantai", "category": "location", "evidence_label": "FIELD VERIFICATION" },
    { "claim": "Halal", "category": "halal-dietary", "evidence_label": "RISK" },
    { "claim": "Persentase PB1 & service charge", "category": "price", "evidence_label": "CLIENT CONFIRMATION" }
  ],
  "assets": [
    { "asset_ref": "KCC-MEDIA-011", "visual_category": "A-original", "people": "none" }
  ],
  "classification": {
    "sensitivity": "Internal",
    "lifecycle": "For Review",
    "scope": "Campaign Specific"
  },
  "approval": { "level": "L2", "approver_role": "Owner cafe (fiktif)" },
  "deadlines": { "draft": "2026-10-15", "publish": "2026-10-28", "publish_time": "06:00", "timezone": "WITA" },
  "restrictions": {
    "required_terms": ["Kafe Contoh Canggu"],
    "forbidden_terms": ["halal", "no pork no lard", "terbaik", "hidden gem"],
    "sensitive_topics": []
  },
  "risks": [
    { "description": "Kata 'halal' muncul di konten padahal outlet tidak bersertifikat", "likelihood": "medium", "impact": "high", "owner": "Content lead", "mitigation": "Masuk forbidden_terms; tulis 'menu tanpa daging' saja" }
  ],
  "next_actions": [
    { "action": "Konfirmasi persentase PB1 & service charge ke owner", "owner": "Content lead", "target": "2026-10-13" },
    { "action": "Ukur waktu jalan kaki ke pantai saat field visit", "owner": "Content lead", "target": "2026-10-14" }
  ]
}
